Date,Headline
11/01/2022,Apple supplier Foxconn quadruples bonuses to staff hit by China COVID lockdown
11/01/2022,Foxconn raises daily bonuses for some staff at Zhengzhou plant in China
10/31/2022,Apple supplier Foxconn gives pay rise to staff hit by COVID lockdown - media
10/31/2022,Oil prices edge lower as China COVID-19 woes dampen demand
10/31/2022,"After Hours Most Active for Oct 31, 2022 : ACGL, AAPL, NYCB, GOOG, GOOGL, T, CSCO, VZ, CG, IBN, CMA, PFE"
10/31/2022,US STOCKS-Wall Street ends strong month on weaker note; focus on Fed meeting
10/31/2022,US STOCKS-Wall Street ends strong month on weaker note; focus on Fed meeting
10/31/2022,US STOCKS-Wall Street falls after two-week rally; eyes on Fed meeting
10/31/2022,Apple Provides Further Proof of Dominance in the Business World
10/31/2022,US STOCKS-Wall St drops as focus shifts to Fed rate decision
10/31/2022,This Industry Titan Is Buying Back Its Stock Hand Over Fist. Should Investors Follow?
10/31/2022,Apple Notches Best Day Since April 2020: 4 ETFs to Taste
10/31/2022,US STOCKS-Wall St drops as megacaps weigh amid Fed rate debate
10/31/2022,Earnings Erase $350B From Big Tech: 5 ETFs With Strength
10/31/2022,Apple's Latest Price Changes Tell Investors a Lot About the Future of the Company
10/31/2022,"Stock Market News for Oct 31, 2022"
10/31/2022,US STOCKS-Wall St set to open lower as investors await Fed signal
10/31/2022,"Technology Sector Update for 10/31/2022: GPN, QNGY, AAPL, XLK, SOXX"
10/31/2022,Apple Inc. (AAPL) Is a Trending Stock: Facts to Know Before Betting on It
10/31/2022,"Pre-Market Most Active for Oct 31, 2022 : TQQQ, SQQQ, LLAP, PBR, QQQ, XPEV, AMZN, AAPL, NIO, CCL, TSLA, GME"
10/31/2022,"Take the Zacks Approach to Beat the Market: Caterpillar, Amgen, Inventiva in Focus"
10/31/2022,EXCLUSIVE-Output of Apple iPhones at major China plant could fall 30% amid COVID curbs -source
10/31/2022,"Fearing COVID, workers flee from Foxconn's vast Chinese iPhone plant"
10/31/2022,Should Invesco NASDAQ 100 ETF (QQQM) Be on Your Investing Radar?
10/31/2022,Is Schwab Fundamental U.S. Broad Market Index ETF (FNDB) a Strong ETF Right Now?
10/31/2022,3 Dividend-Paying Tech Stocks to Buy Right Now
10/31/2022,"China COVID curbs hit iPhone output, shut Shanghai Disney"
10/31/2022,EXCLUSIVE-Output of Apple iPhones at major China plant could fall 30% amid COVID curbs -source
10/31/2022,Apple workers in Australia gear up for more strike action
10/31/2022,EXCLUSIVE-Foxconn COVID woes may hit up to 30% of iPhone November output from Zhengzhou plant -source
10/31/2022,EXCLUSIVE-Foxconn COVID woes may hit up to 30% of iPhone Nov shipments from Zhengzhou plant - source
10/31/2022,Foxconn COVID woes may hit up to 30% of iPhone Nov shipments from Zhengzhou plant - source
10/31/2022,Chinese cities brace for wave of Foxconn workers from COVID-hit Zhengzhou
10/30/2022,"Company Report Roundup: Tesla, Tractor Supply, American Express, and More"
10/30/2022,"Investing in the Stock Market Could Turn Your $10,000 Into $300,000. Here's How."
10/30/2022,"Tesla: ""On a Price-to-Optimism Basis, This Company Is Supercheap."""
10/30/2022,Netflix Stops Giving Subscriber Estimates. Love It.
10/30/2022,"""Rule Breaker Investing"" October Mailbag: Listeners Have a Lot to Say"
10/30/2022,What to Watch as the Big Tech Companies Report Earnings
10/30/2022,What Does Apple's Controversial NFT Policy Mean for Ethereum and Solana?
10/30/2022,Should You Sell Your Spotify Stock Now?
10/29/2022,Making Sense of Big Tech Earnings After Amazon and Meta Tumble
10/29/2022,Here's Why Apple Stock Soared Today
10/29/2022,"After Hours Most Active for Oct 28, 2022 : SHV, PFE, MNTV, VZ, IXUS, AAPL, MCS, INTC, QQQ, ETWO, WFC, JPM"
10/29/2022,US STOCKS-Wall Street surges to sharply higher close ahead of Fed week
10/29/2022,"Technology Sector Update for 10/28/2022: PINS, DAIO, APPF, AAPL"
10/29/2022,US STOCKS-Wall Street surges at end of volatile week ahead of Fed meeting
10/29/2022,"Why Shares of Nvidia, AMD, and Skyworks Are Rallying Today"
10/29/2022,"US STOCKS-Wall Street jumps on solid earnings, encouraging data ahead of 'Fed week'"
10/29/2022,"US STOCKS-Wall Street jumps about 2% on upbeat Apple results, hopes of slowing rate hikes"
10/29/2022,"Technology Sector Update for 10/28/2022: DAIO, APPF, AAPL"
10/29/2022,Exxon and Apple are in a similar boat
10/29/2022,Blue Chip Stocks To Invest In Right Now? 2 In Focus
10/29/2022,Stocks Still Eye Weekly Wins Despite Big Tech Bust
10/29/2022,"Apple (AAPL) Q4 Earnings Top Estimates, Revenues Increase Y/Y"
10/29/2022,"Friday Sector Leaders: Computers, Credit Services & Lending Stocks"
10/29/2022,"Daily Dividend Report: AAPL,BKR,ABBV,ROK,WBA"
10/29/2022,"Amazon shares slump, Big Tech peers stay afloat"
10/29/2022,"Dow Movers: MRK, INTC"
10/29/2022,US STOCKS-Wall Street rises as Apple boost outweighs Amazon gloom
10/29/2022,Apple's Steady Results Prove Why It's the Ultimate Warren Buffett Stock
10/29/2022,The Good News from Apple (AAPL) is Being Overlooked
10/29/2022,"US STOCKS SNAPSHOT-Nasdaq opens lower as warnings from Amazon, Apple weigh"
10/29/2022,"US STOCKS-S&P 500, Nasdaq set to open lower after Amazon, Apple warnings"
10/29/2022,"Pre-Market Most Active for Oct 28, 2022 : TQQQ, AMZN, SQQQ, AAPL, NIO, INTC, XPEV, CMCSA, CNX, FMS, BABA, TAL"
10/29/2022,"US STOCKS-Futures retreat as warnings from Amazon, Apple fan recession fears"
10/29/2022,7 Must-See Metrics Highlight Apple's Record Fiscal Fourth Quarter
10/29/2022,Amazon slumps as tech selloff worsens
10/29/2022,Where Will Meta Platforms Be In 1 Year?
10/29/2022,Did Apple Just Stick a Pin in the Google-Facebook Duopoly?
10/29/2022,"With Talk of a Recession Brewing, Here's How Investors Can Prepare to Ride Out the Storm"
10/29/2022,"US STOCKS-Futures sink as grim forecasts from Amazon, Apple fan recession fears"
10/29/2022,"European shares fall on commodity weakness, mixed earnings"
10/29/2022,Apple Music Just Raised Its Prices. Here's What It Means for Spotify
10/29/2022,"Apple Stock: The Big Tech Winner Has an “Attractive” Risk-Reward Profile, Says Deutsche Bank"
10/28/2022,ANALYSIS-Tech wreck shows U.S. megacaps not immune to corrosive Fed tightening
10/28/2022,"ANALYSIS-For Twitter boss Elon Musk, now comes the hard part"
10/28/2022,"ANALYSIS-For Twitter boss Elon Musk, now comes the hard part"
10/28/2022,Apple (AAPL) Q4 2022 Earnings Call Transcript
10/28/2022,Good Stocks To Invest In Today? 2 S&P 500 Stocks To Watch
10/28/2022,"AAPL, PINS Beat; AMZN, INTC Mixed but Down"
10/28/2022,Apple (AAPL) Q4 Earnings and Revenues Beat Estimates
10/28/2022,The Apple Report: Tech-Gadget Giant “Phones It In”
10/28/2022,Wall St loses over $200 billion in value after report from Amazon
10/28/2022,How Midterms Could Impact Your ETF Portfolio
10/28/2022,"Apple falls short on iPhone sales, stock falls despite earnings beat"
10/28/2022,"Apple Inc. Q4 Income Advances, Beats estimates"
10/28/2022,"US STOCKS-S&P 500, Nasdaq slide, but Dow ends higher on mixed earnings picture"
10/28/2022,"After Hours Most Active for Oct 27, 2022 : AMZN, AAPL, SNAP, TQQQ, SQQQ, TWTR, ATUS, QQQ, INTC, PINS, WFC, C"
10/28/2022,"US STOCKS-S&P 500, Nasdaq end lower but the Dow jumps as earnings bifurcate"
10/28/2022,MORNING BID-The yen also rises
10/28/2022,"US STOCKS-Dow jumps, Nasdaq sinks on mixed earnings"
10/28/2022,"EU wants 40-man antitrust team to enforce new tech rules, official says"
10/28/2022,Apple (AAPL) Earnings: Previewing a Potential Options Trade
10/28/2022,"After-Hours Earnings Report for October 27, 2022 : AAPL, AMZN, TMUS, INTC, GILD, VRTX, PXD, EW, LHX, RSG, DXCM, COF"
10/28/2022,"US STOCKS-Dow jumps on earnings boost, Meta drags Nasdaq lower"
10/28/2022,Is This Your Last Chance to Buy Spotify Under $100?
10/28/2022,"IYW, SCHQ: Big ETF Inflows"
10/28/2022,US STOCKS-Dow jumps on earnings boost; Meta weighs on Nasdaq
10/28/2022,"As the Evidence Mounts, a Soft Landing Now Looks Possible"
10/28/2022,"Dow Movers: AAPL, CAT"
10/28/2022,Google Play in EU antitrust sights as Android fine appeal pending
10/28/2022,"US STOCKS-Dow, S&P 500 eye higher open after GDP data"
10/28/2022,Jamie Dimon Says the U.S. Economy May Be Headed for a Recession -- Here Are 2 Top Index Funds to Buy Now and Hold Forever
10/28/2022,Apple (AAPL) Q4 2022 Earnings: What to Expect
10/28/2022,US STOCKS-Nasdaq futures fall as Meta plummets on dismal outlook
10/28/2022,Should You Invest in the First Trust Indxx NextG ETF (NXTG)?
10/28/2022,Should Motley Fool 100 Index ETF (TMFC) Be on Your Investing Radar?
10/28/2022,"MORNING BID-Meta averse, ECB decides and CS slides"
10/28/2022,2 Cryptocurrencies That Are Down More Than 70% and Ready to Pop
10/28/2022,Apple Q4 22 Earnings Conference Call AT 5:00 PM ET
10/28/2022,"US STOCKS-Futures climb on easing rate hike bets, Meta plunges on dismal outlook"
10/28/2022,"GLOBAL MARKETS-Asia shares rise on hopes of rate hike slowdown, ECB in focus"
10/28/2022,"POLL-Taiwan Q3 GDP seen growing 3.2%, struggling against trade headwinds"
10/27/2022,Will iPhone Revenue Boost Apple (AAPL) Stock?
10/27/2022,Why Netflix Stock Jumped as Much as 5.1% Today
10/27/2022,"US STOCKS-S&P 500 ends lower, snapping rally on mounting slowdown fears"
10/27/2022,"After Hours Most Active for Oct 26, 2022 : META, SNAP, TQQQ, AAPL, QQQ, WFC, F, SQQQ, RTO, BP, FDX, AMZN"
10/27/2022,Meta Platforms beats estimates for quarterly revenue
10/27/2022,Meta Platforms beats estimates for quarterly revenue
10/27/2022,"US STOCKS-S&P 500 ends lower, snapping rally on mounting slowdown fears"
10/27/2022,"PREVIEW-Apple's holiday quarter may face pressure from inflation, weak China demand"
10/27/2022,"US STOCKS-S&P, Nasdaq pulled lower as tech earnings misses fuel slowdown fears"
10/27/2022,Shopify (SHOP) to Report Q3 Earnings: What's in the Cards?
10/27/2022,SONY Gears Up to Report Q2 Earnings: Here's What to Expect
10/27/2022,"IVV, AAPL, MSFT, GOOG: Large Inflows Detected at ETF"
10/27/2022,Big Tech tumbles as results set off alarm bells
10/27/2022,US STOCKS-Nasdaq falls as weak Big Tech earnings fan growth concerns; Visa buoys Dow
10/27/2022,Can Higher Revenues Aid Monolithic Power (MPWR) Q3 Earnings?
10/27/2022,Will Slowing Services Growth Hurt Apple's (AAPL) Q4 Earnings?
10/27/2022,Target Expands Collaboration With Apple To Triple Apple At Target Locations
10/27/2022,US STOCKS-Nasdaq futures drop nearly 2% as weak tech earnings fan slowdown fears
10/27/2022,Is a Surprise Coming for Apple (AAPL) This Earnings Season?
10/27/2022,"Apple’s (NASDAQ:AAPL) Q4 Preview: Revenues to Hit Estimates, Says Analyst"
10/27/2022,US STOCKS-Nasdaq futures drop over 1% as weak tech earnings fan slowdown fears
10/27/2022,Big Tech tumbles as results sound alarm bells
10/27/2022,Is iShares U.S. Equity Factor ETF (LRGF) a Strong ETF Right Now?
10/27/2022,Should John Hancock Multifactor Large Cap ETF (JHML) Be on Your Investing Radar?
10/27/2022,Should Franklin U.S. Large Cap Multifactor Index ETF (FLQL) Be on Your Investing Radar?
10/27/2022,Apple's Most Important Catalyst Just Got Better
10/27/2022,US STOCKS-Nasdaq futures fall 1% as tech earnings spark slowdown fears
10/26/2022,LG Display posts bigger-than-expected Q3 loss on sluggish device sales
10/26/2022,Poor report cards at U.S. companies fan recession fears
10/26/2022,Don't Overlook Service Revenues in Apple's Q4
10/26/2022,Apple's iPhone Revenue Set to Be Key in Q4 Earnings
10/26/2022,Apple Q4 Preview: Another EPS Beat Inbound?
10/26/2022,Top 10 Wide-Moat Stocks to Buy Now
10/26/2022,GRAPHIC-S&P 500 adds to mid-October rebound from bear market low
10/26/2022,Will Lower Ad Revenues Hurt Meta Platforms (META) Q3 Earnings?
10/26/2022,US STOCKS-Nasdaq leads Wall St higher on hopes of less-hawkish Federal Reserve
10/26/2022,US STOCKS-Nasdaq leads Wall Street higher as investors brace for megacap earnings
10/26/2022,Why Is Everyone Talking About Apple?
10/26/2022,"ESGU, KALL: Big ETF Outflows"
10/26/2022,What's in Store for Western Digital (WDC) in Q1 Earnings?
10/26/2022,US STOCKS-Nasdaq leads Wall Street higher as investors brace for megacap earnings
10/26/2022,"CANADA STOCKS-Cannabis stocks, upbeat Wall St mood lifts TSX"
10/26/2022,Will Top-Line Contraction Dent Intel (INTC) Q3 Earnings?
10/26/2022,Will Higher Revenues Benefit T-Mobile (TMUS) Q3 Earnings?
10/26/2022,Why Earnings from General Motors (GM) and Coca-Cola (KO) Have Changed the Overall Outlook for Stocks
10/26/2022,"This Growth Stock Is Down 90%, but Is It a Buy Now?"
10/26/2022,"This Growth Stock Is Down 90%, but Is It a Buy Now?"
10/26/2022,"Stock Market News for Oct 25, 2022"
10/26/2022,Nasdaq Bear Market: 2 Warren Buffett Stocks to Buy Hand Over Fist
10/26/2022,"The Zacks Analyst Blog Highlights Microsoft, Alphabet, Apple and Amazon."
10/26/2022,"The Zacks Analyst Blog Highlights Alphabet, Microsoft, Apple and Amazon"
10/26/2022,"Apple announces new clean energy investments, asks suppliers to decarbonize"
10/26/2022,"The Zacks Analyst Blog Highlights Apple, Netflix, Disney and Amazon"
10/26/2022,"Pre-Market Most Active for Oct 25, 2022 : TQQQ, TSHA, SQQQ, CSX, PINS, EBAY, AAPL, NIO, M, BABA, SNAP, GM"
10/26/2022,Apple is cutting back production of iPhone 14 Plus due to weak demand - TrendForce
10/26/2022,"Solana Might Be Down 85%, But It Has a Jaw-Dropping Strategy to Bounce Back in 2023"
10/26/2022,Is Snap Stock a Buy Now?
10/26/2022,Is Franklin U.S. Large Cap Multifactor Index ETF (FLQL) a Strong ETF Right Now?
10/26/2022,Is Fidelity High Dividend ETF (FDVV) a Strong ETF Right Now?
10/26/2022,Is WisdomTree U.S. LargeCap ETF (EPS) a Strong ETF Right Now?
10/26/2022,Apple is cutting back production of iPhone 14 Plus due to weak demand - TrendForce
10/26/2022,Adidas plans to end Kanye West partnership over 'offensive behaviour' - Bloomberg News
10/26/2022,European stocks rise as earnings offset economic gloom
10/26/2022,GLOBAL MARKETS-Asia stocks struggle as Xi's leadership team spooks markets
10/24/2022,"GLOBAL MARKETS-Asian stocks ease to 2-1/2-year lows, pound lifted by Sunak's victory"
10/24/2022,Microsoft powers up search for Chinese gaming hits in race against Sony
10/24/2022,Take a Bite in Apple Stock Before Earnings?
10/24/2022,"Markets Up Big from a Month Ago, Earnings On Deck"
10/24/2022,"GLOBAL MARKETS-U.S., European shares climb on hopes Fed will slow rate hike pace"
10/24/2022,US STOCKS-Wall St closes sharply higher on hopes of abating Fed
10/24/2022,"After Hours Most Active for Oct 24, 2022 : PFE, PM, IXUS, QQQ, AIV, CSCO, ESTC, SNAP, BSX, AAPL, INTC, AMZN"
10/24/2022,Stocks Extend Rally Ahead of Big Tech Earnings
10/24/2022,US STOCKS-Wall St closes up on hopes of abating Fed
10/24/2022,US STOCKS-Wall St rises as data hints at Fed policy progress
10/24/2022,US STOCKS-Wall St rises on hopes of less-aggressive Fed as business activity shrinks
10/24/2022,Big-Tech Earnings Week Commences
10/24/2022,US STOCKS-Wall Street mixed after weak business data; Tesla drags Nasdaq
10/24/2022,GLOBAL MARKETS-Dollar shakes off suspected Japan intervention; stocks brace for earnings
10/24/2022,"Alphabet, Microsoft, Meta Platforms, Apple and Amazon are part of Zacks Earnings Preview"
10/24/2022,Wolfspeed (WOLF) to Report Q1 Earnings: What's in the Cards?
10/24/2022,Apple (AAPL) to Report Q4 Earnings: What's in the Offing?
10/24/2022,US STOCKS-Wall Street set to open higher as bond yields retreat
10/24/2022,US STOCKS-Futures reverse losses as bond yields retreat
10/24/2022,Will Higher Revenues Benefit Corning (GLW) Q3 Earnings?
10/24/2022,Can Top-Line Improvement Aid Juniper (JNPR) Q3 Earnings?
10/24/2022,GLOBAL MARKETS-Dollar shakes off suspected Japan intervention; stocks brace for earnings
10/24/2022,Is iShares MSCI ACWI Low Carbon Target ETF (CRBN) a Strong ETF Right Now?
10/24/2022,US STOCKS-Futures slide as China worries sour global mood
10/24/2022,"GLOBAL MARKETS-Dollar shrugs off suspected yen intervention, Europe clings to Fed hopes"
10/24/2022,"GLOBAL MARKETS-Dollar absorbs suspected yen intervention, China data mixed"
10/23/2022,"GLOBAL MARKETS-Dollar weathers suspected yen intervention, China data mixed"
10/23/2022,"GLOBAL MARKETS-Dollar see saws on suspected yen intervention, shares rally"
10/23/2022,Snap's Stock Crashes as Apple's Policy Changes Crimp Advertiser Demand
10/23/2022,Wall St Week Ahead-Megacap earnings to test fledgling U.S. stock rebound
10/23/2022,"Weekly Preview: Earnings To Watch (AAPL, AMZN, GOOG, META, MSFT) - Week of October 23"
10/22/2022,Dividend Stocks That Do More Than Just Boost Their Payout
10/22/2022,This Dow Jones Stock Is a No-Brainer for Dividend Growth
10/21/2022,MSFT vs. AAPL vs. TTWO: Which Stock is Best amid Video-Gaming Wars?
10/21/2022,Wall St Week Ahead-Megacap earnings to test fledgling U.S. stock rebound
10/21/2022,US STOCKS-Wall Street ends higher as hopes for less aggressive Fed grow
10/21/2022,US STOCKS-Wall Street ends higher as hopes for less aggressive Fed grow
10/21/2022,US STOCKS-Wall Street rallies on hopes of less aggressive Fed
10/21/2022,Here's What to Expect from Big Tech Earnings
10/21/2022,"Notable Friday Option Activity: ORCL, COST, AAPL"
10/21/2022,Why Snap Stock Got Crushed Early Friday
10/21/2022,It's Time for Alphabet Stock to Pay a Dividend
10/21/2022,Apple's industrial design head Hankey to leave - Bloomberg News
10/21/2022,First Leg of Earnings Season Going Better Than Expected
10/21/2022,"PDBC, DYNF: Big ETF Outflows"
10/21/2022,Meta Platforms (META) to Report Q3 Earnings: What to Expect
10/21/2022,"Q3 Earnings Decent So Far; Big Tech Next: AAPL, MSFT, GOOGL, etc."
10/21/2022,"2 Reasons to Buy Apple Stock, and 1 Reason to Sell"
10/21/2022,Amphenol (APH) to Report Q3 Earnings: What's in the Cards?
10/21/2022,ServiceNow (NOW) to Report Q3 Earnings: What's in the Cards?
10/21/2022,What Lies Ahead for Big Tech ETFs in Q3 Earnings?
10/21/2022,Burned by Tech Stocks? Try These 3 ETFs Instead
10/21/2022,US STOCKS-Nasdaq futures slide 1% as Snap's ad warning spurs social media selloff
10/21/2022,Want to Get Richer? 3 Top Stocks to Buy Now and Hold Forever
10/21/2022,Zuckerberg's Metaverse Bet Is More Than Experimental - It's Key to Meta's Survival
10/21/2022,77% of Warren Buffett's $313 Billion Portfolio Is Invested in These 6 Stocks
10/20/2022,Foxconn says production normal at iPhone plant in China despite COVID curbs
10/20/2022,Foxconn imposes restrictions on iPhone assembly plant in China's Zhengzhou - SCMP
10/20/2022,How Critical Is This Earnings Season?
10/20/2022,"After Hours Most Active for Oct 20, 2022 : SNAP, ATUS, IMUX, ADT, DDL, AUY, IHS, ESGU, TQQQ, AAPL, MQ, QQQ"
10/20/2022,Microsoft (MSFT) to Report Q1 Earnings: What's in the Cards?
10/20/2022,Apple Reports After the Close on 10/27 -- Options Contracts Expire the Next Day
10/20/2022,Apple (AAPL) Earnings Expected to Grow: Should You Buy?
10/20/2022,Meta Platforms (META) Banks on AI to Boost Growth Prospects
10/20/2022,Thursday's ETF with Unusual Volume: FTHI
10/20/2022,"US STOCKS-S&P 500, Dow futures up after positive forecasts from IBM, AT&T"
10/20/2022,Amazon faces $1 bln lawsuit in UK for 'favouring its own products'
10/20/2022,MSCI Scheduled to Report Q3 Earnings: What's in the Cards?
10/20/2022,Is Goldman Sachs ActiveBeta World Low Vol Plus Equity ETF (GLOV) a Strong ETF Right Now?
10/20/2022,My Top 2 Dividend Stocks to Buy Now
10/20/2022,"Taiwan Sept export orders contract, but strong electronics sales reported"
10/20/2022,"Nokia, Ericsson slump as patent fights hit margins"
10/19/2022,SNAP Earnings Preview: Can the Social Media Stock Finally Rebound?
10/19/2022,Tesla’s Apple-sized goals have cash risks
10/19/2022,PREVIEW-Digital ad market shows 'signs of life' but economy clouds 2023 outlook
10/19/2022,"Netflix (NFLX) Q3 Earnings Beat, User Gain Higher Than Expected"
10/19/2022,Apple (AAPL) Expands Portfolio With Redesigned & Next-Gen iPads
10/19/2022,US STOCKS-Wall St struggles to gain as soaring Treasury yields hurt earnings confidence
10/19/2022,"1 Growth Stock Set to Soar 1,000%, According to Cathie Wood"
10/19/2022,US STOCKS-Wall St set to open lower as soaring Treasury yields dampen Netflix-led gains
10/19/2022,US STOCKS-Futures down as surging Treasury yields dampen Netflix-led gains
10/19/2022,Zacks Industry Outlook Highlights Apple and 3D Systems
10/19/2022,"Investor group, unions push Hyundai to address child labor at U.S. suppliers"
10/19/2022,Taiwan and U.S. tensions with China pose 'serious' challenges for chip industry - TSMC
10/19/2022,"Taiwan-China, U.S.-China tensions 'serious' challenge for chip industry, TSMC says"
10/18/2022,POLL-Taiwan Sept export orders likely contracted
10/18/2022,Apple (AAPL) Gains But Lags Market: What You Should Know
10/18/2022,Mexican opposition lawmaker says he was target of Pegasus spyware
10/18/2022,"US STOCKS-Goldman, Lockheed results buoy Wall Street"
10/18/2022,"US STOCKS-Goldman, Lockheed results buoy Wall Street"
10/18/2022,"Apple Unveils New IPad Pros, IPad And Apple TV 4K"
10/18/2022,Apple cuts production of iPhone 14 Plus - the Information
10/18/2022,EXPLAINER-Parler: what is the social media app Kanye West is buying?
10/18/2022,Apple cuts production of iPhone 14 Plus - the Information
10/18/2022,Diving into the FAANG Stock Earnings Charts
10/18/2022,"US STOCKS-Wall St up as Goldman results keep optimism alive, rising yields cap gains"
10/18/2022,"VONG, TBIL: Big ETF Inflows"
10/18/2022,"Notable ETF Inflow Detected - VOO, AAPL, MSFT, GOOG"
10/18/2022,US STOCKS-Wall St climbs as Goldman winds up big bank earnings on upbeat note
10/18/2022,What Are The Best Stocks To Invest In? 3 Growth Stocks For Your List
10/18/2022,Will Top-Line Contraction Dent AT&T's (T) Earnings in Q3?
10/18/2022,"US STOCKS-Wall St set to jump at open as Goldman, J&J results lift earnings mood"
10/18/2022,Why Microsoft Is Down 29% This Year
10/18/2022,"Pre-Market Most Active for Oct 18, 2022 : TQQQ, SQQQ, AKUS, TSLA, QQQ, FUBO, CCL, NIO, AAPL, XPEV, HLN, APE"
10/18/2022,Netflix (NFLX) Adds Profile Transfer Feature Ahead of Q3 Earnings
10/18/2022,"The Zacks Analyst Blog Highlights Apple, Abbott Laboratories, International Business Machines, Estee Lauder and Progressive"
10/18/2022,US STOCKS-Futures firmly up as J&J results boost earnings optimism
10/18/2022,US STOCKS-Futures extend rally on earnings optimism
10/18/2022,Apple Is Using Streaming to Unlock Another Growing Business
10/18/2022,"PREVIEW-Goldman to merge investment banking, trading as Marcus takes backseat"
10/17/2022,Taiwan's Foxconn says it wants customers to sell 'a lot' of EVs
10/17/2022,Taiwan's Foxconn says wants its customers to sell a lot of EVs
10/17/2022,"After Hours Most Active for Oct 17, 2022 : MLKN, CSCO, AAPL, QQQ, WLK, RTO, BAC, MSFT, ONTF, PYPL, PFE, CCL"
10/17/2022,"US STOCKS-Wall Street rallies after BofA results, UK reversal"
10/17/2022,"US STOCKS-Wall Street rallies after BofA results, UK reversal"
10/17/2022,"US STOCKS-Wall Street jumps after BofA results, UK reversal"
10/17/2022,"Q3 Earnings Scorecard and Analyst Reports for Apple, Abbott, IBM & Others"
10/17/2022,Alphabet (GOOGL) Enhances YouTube With Homescreen Widgets
10/17/2022,Charter's (CHTR) Spectrum Expands Operations in Loudon County
10/17/2022,US STOCKS-Wall Street jumps as BofA results spark rally
10/17/2022,Why PayPal Stock Was Outperforming the Market Today
10/17/2022,US STOCKS-Wall Street jumps as solid BofA results spark rally
10/17/2022,US STOCKS-Wall Street surges as BofA gains on earnings beat
10/17/2022,Are You a Growth Investor? This 1 Stock Could Be the Perfect Pick
10/17/2022,"Stock Market News for Oct 17, 2022"
10/17/2022,US STOCKS-Wall Street set to open higher as BofA rises on earnings beat
10/17/2022,Mercedes-Benz Adds Apple Music With Spatial Audio
10/17/2022,2 Stocks to Watch From the Challenging Computer Industry
10/17/2022,US STOCKS-Wall Street futures extend gains as BofA rises after earnings
10/17/2022,Should Schwab 1000 Index ETF (SCHK) Be on Your Investing Radar?
10/17/2022,Is Invesco Dynamic Large Cap Growth ETF (PWB) a Strong ETF Right Now?
10/17/2022,Should First Trust Rising Dividend Achievers ETF (RDVY) Be on Your Investing Radar?
10/17/2022,Here's the FAANG Stock Wall Street Thinks Will Soar the Most Over the Next 12 Months
10/17/2022,US STOCKS-Wall St futures higher with focus on earnings
10/17/2022,India's Reliance Jio selects Nokia as equipment provider in 5G push
10/17/2022,Apple freezes plans to use China's YMTC chips - Nikkei
10/16/2022,Apple freezes plan to use China's YMTC chips - Nikkei
10/16/2022,"$5,000 Invested in These Growth Stocks Could Make You Rich Over the Next 10 Years"
10/16/2022,Why Occidental Petroleum Could Be Warren Buffett's Next Apple
10/16/2022,I've Already Made 158% on Bitcoin. Here's Why I Keep Holding.
10/16/2022,"5 Stocks That Turned a $10,000 Investment Into $1 Million"
10/15/2022,Apple Workers In Oklahoma City Win Union Election To Join CWA
10/15/2022,"Market News From AMD, McCormick, Peloton, and More"
10/15/2022,Nasdaq Bear Market: What History Taught Investors
10/15/2022,3 Reasons Apple Is a Warren Buffett Stock
10/15/2022,An Investor's Look at Semiconductors
10/15/2022,How Warren Buffett Receives a Staggering 54% Yield From This Dividend Aristocrat
10/14/2022,Apple workers vote to unionize second U.S. store
10/14/2022,"After Hours Most Active for Oct 14, 2022 : SMRT, RTO, PING, QQQ, HBAN, AAPL, AMZN, LBRT, C, VZ, INTC, TQQQ"
10/14/2022,Netflix (NFLX) Gears Up for Q3 Earnings: What's in the Cards?
10/14/2022,Friday's ETF with Unusual Volume: FCTR
10/14/2022,"ROKU Expands The Roku Channel Internationally, Grows Library"
10/14/2022,3 Reasons Apple Stock Is a Great Buy Today
10/14/2022,"Company News for Oct 14, 2022"
10/14/2022,Is This Top Warren Buffett Dividend Stock a Buy Now?
10/14/2022,Microsoft Just Gave Meta Platforms a Big Vote of Confidence
10/14/2022,Investing in This ETF Right Now Could Make You a Millionaire Retiree
10/14/2022,"Banks Are Now as Leveraged as They Were Before the Great Recession, but Don't Panic"
10/14/2022,3 Best Buffett Stocks to Buy for the Long Haul
