Date,Headline
06/10/2022,"Stock Market News for Jun 10, 2022"
06/10/2022,How to Build a Stock Portfolio for New Investors
06/10/2022,Will Big Tech or Bitcoin Be Regulated?
06/10/2022,How Does Dollar Cost Averaging Work?
06/10/2022,Why Bundled Services Could Help Streamers Stem Subscriber Losses
06/10/2022,7 Large Cap Stocks to Buy for Long-Term Stability
06/10/2022,2 Reasons Investors Should Love Apple Pay Later
06/10/2022,ANALYSIS-Buy Now Pay Later business model faces test as rates rise
06/10/2022,The 3 Reasons to Own PayPal Stock
06/10/2022,Why Big Businesses Could Dominate AR in the Near Future
06/10/2022,"CMA Begins Consulting On Launch Of Market Investigation Into Mobile Browsers, Access To Cloud Gaming"
06/10/2022,"UK plans to probe Apple, Google's mobile browser dominance"
06/10/2022,Prediction: These 3 Warren Buffett Stocks Will Be the Biggest Winners This Decade
06/10/2022,"UK plans to probe Apple, Google's mobile browser dominance"
06/10/2022,2 Compelling Tech Stocks That Score a ‘Perfect 10’
06/9/2022,"GLOBAL MARKETS-Asian stocks track global shares lower, U.S. CPI in focus"
06/9/2022,Why the Shine Was Off Apple Stock Today
06/9/2022,BlackRock Owns These 3 High-Quality Stocks; Should You?
06/9/2022,Best ETF Ideas for the Second Half of 2022
06/9/2022,Buy Apple Stock Now To Profit From Second-Half Rally
06/9/2022,US STOCKS-Wall St drops as investor jitters climb before CPI data Friday
06/9/2022,"After Hours Most Active for Jun 9, 2022 : KGC, MO, JD, MRO, ETWO, BABA, PFE, QQQ, ADPT, AAPL, DOCU, FOLD"
06/9/2022,Why Shares of Affirm Are Down Today
06/9/2022,Apple pay-later foray blurs tech-finance boundary
06/9/2022,Wall Street falls as growth stocks struggle with inflation reading in focus
06/9/2022,Apple (AAPL) Relies on Subsidiary to Manage Apple Pay Later
06/9/2022,Interesting AAPL Put And Call Options For July 29th
06/9/2022,2 Top Warren Buffett Stocks to Buy Right Now
06/9/2022,1 Reason Bitcoin Still Looks Overvalued
06/9/2022,Apple Stock: The Bull and Bear Cases Today
06/9/2022,The Apple of Law Enforcement -- Is Axon a Top Stock to Buy Now?
06/9/2022,"IVV, JDST: Big ETF Inflows"
06/9/2022,Wall Street slips as growth stocks struggle amid rising bond yields
06/9/2022,The Biggest Mistake Disney Investors Can Make Right Now
06/9/2022,A Netflix-Roku Deal Isn't Going to Happen
06/9/2022,"China's smartphone makers chip away at Samsung, Apple's Russian market share"
06/9/2022,"Stock Market News for Jun 9, 2022"
06/9/2022,Alphabet’s Stock Split Could Be a Major Catalyst
06/9/2022,"Down 43%, Should Investors Buy the Dip in Meta Platforms?"
06/9/2022,Will the New M2 MacBook Air Be Enough to Kickstart Apple?
06/9/2022,Did Apple Just Put a Nail in Matterport's Coffin?
06/9/2022,Implied IXN Analyst Target Price: $62
06/9/2022,"US STOCKS-Futures rebound as Tesla, other growth stocks gain"
06/9/2022,"Top Stock Market News For Today June 9, 2022"
06/9/2022,'Apple Pay Later' Might Crush These Growth Stocks
06/9/2022,7 Stocks That Look Like Big Bargains Right Now
06/8/2022,Intel freezes hiring in PC chip division for at least two weeks
06/8/2022,Apple to fund pay-later loans off its own balance sheet
06/8/2022,Invest Like Warren Buffett With These 3 Stocks
06/8/2022,U.S. Senate likely to pass bill to bar tech firms' favoring themselves in searches
06/8/2022,Nancy Pelosi Discloses Trades in Apple and Microsoft
06/8/2022,Russia's Sberbank to close gaming unit as restrictions bite
06/8/2022,Better Buy: Twitter vs. Meta Platforms
06/8/2022,Paycom (PAYC) Extends Buyback Plan to Boost Shareholder Value
06/8/2022,The Biggest Opportunity in the Crypto Crash
06/8/2022,"S&P 500, Dow fall as Intel slides"
06/8/2022,ROKU Stock News: 10 Things to Know About the Netflix Deal Rumors Pushing Roku Shares Higher
06/8/2022,Why Disney Is Already Winning the Streaming Wars
06/8/2022,How Will FAANG Stocks Do in 2022? What the Charts Say Now.
06/8/2022,Amazon Stock Is Always a Buy on Dips
06/8/2022,Alphabet (GOOGL) Boosts Smartwatch Efforts With New Feature
06/8/2022,Will Apple (AAPL) Stock Rebound Post WWDC22 Announcements?
06/8/2022,"Stock Market News for Jun 8, 2022"
06/8/2022,The Deeper Implications of Apple's (AAPL) Shift Towards Service Revenue
06/8/2022,These 2 Meme Stocks Have Legitimate Long-Term Upsides
06/8/2022,US STOCKS-Wall Street set to open lower as tech rally loses steam
06/8/2022,Baidu's electric vehicle firm Jidu unveils first 'robot' car
06/8/2022,US STOCKS-Futures slip as tech-driven rally loses steam
06/8/2022,Microsoft cuts Russia operations due to Ukraine invasion - Bloomberg News
06/8/2022,UK loses court challenge against EU order to recover millions in state aid
06/8/2022,"Top Stock Market News For Today June 8, 2022"
06/8/2022,"Taiwan May export growth steady despite supply chain snarls, outlook positive"
06/8/2022,Warren Buffett Has Gained Over $171 Billion On These 4 Stocks
06/8/2022,"Taiwan May export growth steady despite supply chain snarls, outlook positive"
06/8/2022,"Apple's new car software no threat, complements our products, says Panasonic"
06/8/2022,Japan's Nikkei ends at 2-1/2-month high as tech stocks rally
06/7/2022,Apple (AAPL) Outpaces Stock Market Gains: What You Should Know
06/7/2022,"US STOCKS-Wall St jumps with tech, energy; Target news weighs on retailers"
06/7/2022,"Despite a Tough Day for Retail, 2 Stocks Helped Lift the Dow Jones Higher Today"
06/7/2022,"Wall Street ends up with tech, energy; Target falls after margin warning"
06/7/2022,"No, the Success of Top Gun: Maverick Isn’t Enough to Save AMC Stock"
06/7/2022,Shopify shareholders give CEO 40% voting stake - source
06/7/2022,"US STOCKS-Wall St gains with tech, energy; Target's margin warning a negative"
06/7/2022,Apple Versus the Energy Sector: Which Is the Better Buy?
06/7/2022,ANALYSIS-Apple's next frontier is your car's dashboard
06/7/2022,Risk Taking Has Been a Winning Move for Disney. Will Its Latest Gamble Pay Off?
06/7/2022,Meta Platforms (FB) Launches Feature to Track VR Fitness Stats
06/7/2022,Apple Overhauls CarPlay With Major New Features
06/7/2022,"Buy now, pay later stocks roiled by Apple's entry"
06/7/2022,Rule Breaker Investing Mailbag: Dealing With the Market
06/7/2022,"USB Type-C To Become Common Charging Port For Portable Electronics Devices In The EU, By Autumn 2024"
06/7/2022,"Apple Pay Later Just Crushed Affirm's Dreams, but It's a Nice Win for 2 Fintech Giants"
06/7/2022,"Stock Market News for Jun 7, 2022"
06/7/2022,US STOCKS-Wall St set to open lower as Target's margin warning fuels demand worries
06/7/2022,"Pre-Market Most Active for Jun 7, 2022 : DIDI, SQQQ, C, TQQQ, AMZN, GM, AAPL, TGT, ET, KO, KHC, QQQ"
06/7/2022,Apple Announces M2 Chip: What Investors Need to Know
06/7/2022,Apple Stock: Why Now Is the Time to Buy
06/7/2022,"EU countries, lawmakers clinch deal on single mobile charging port, Apple impacted"
06/7/2022,"Top Stock Market News For Today June 7, 2022"
06/7/2022,"EU countries, lawmakers clinch deal on single mobile charging port"
06/7/2022,Australia's BNPL stocks wilt after Apple announces entry
06/7/2022,GRAPHIC-Amazon stock split may draw retail traders in tough market
06/6/2022,3 Tech Stocks Investors Should Always Buy During Market Weakness
06/6/2022,Markets Cooler on a Slower News Day
06/6/2022,"US STOCKS-Wall St ends up with growth stocks, but inflation fears linger"
06/6/2022,"After Hours Most Active for Jun 6, 2022 : DIDI, C, TAL, BABA, KGC, BEKE, AAPL, IQ, PYPL, MSFT, LI, QCOM"
06/6/2022,Apple Unveils Redesigned MacBook Air With M2 Chip
06/6/2022,GRAPHIC-Amazon stock split may draw retail traders in tough market
06/6/2022,Alphabet (GOOGL) Boosts YouTube Music With Updated Playlist
06/6/2022,Monday's ETF with Unusual Volume: SPGP
06/6/2022,Disney (DIS) to Stream Marvel Studios' Latest on Disney Plus
06/6/2022,"S&P 500, Nasdaq edge higher in choppy trade as growth stocks rise"
06/6/2022,Is It Time to Buy Netflix?
06/6/2022,Wall Street rebounds as growth stocks rally; Twitter falls
06/6/2022,Amazon’s Stock Splits Monday – Is It Time to Buy?
06/6/2022,"Stock Market News for June 6, 2022"
06/6/2022,"As Apple upgrades its software, developers hunt for headset hints"
06/6/2022,Is Most-Watched Stock Apple Inc. (AAPL) Worth Betting on Now?
06/6/2022,"Wall Street set to rebound as China ADRs, growth stocks rally"
06/6/2022,"Don’t Fear Recession, Prepare Instead"
06/6/2022,"Representing 40% of Warren Buffett's Portfolio, Here Is Why Apple Is a Great Stock to Own Today"
06/6/2022,Retail Investors Prop Up Tesla Stock Despite Dark Clouds in Distance 
06/6/2022,Daily Markets: Apple's (AAPL) 2022 WWDC Gets Underway
06/6/2022,US STOCKS-Futures rebound as China ADRs rally; growth stocks rise
06/6/2022,"As Apple upgrades its software, developers hunt for headset hints"
06/6/2022,3 Top Warren Buffett Stocks to Buy and Hold for Decades
06/6/2022,"US STOCKS-Futures rebound as China ADRs rally; tech, growth stocks rise"
06/6/2022,"Top Stock Market News For Today June 6, 2022"
06/6/2022,91% of Warren Buffett's Portfolio Is in These 4 Sectors
06/6/2022,"POLL-Taiwan May exports seen rising for 23rd month, but more slowly"
06/5/2022,2 Top Stocks to Buy With $500
06/5/2022,Stock Market Definition
06/5/2022,"If I Could Buy Only 1 Warren Buffett Stock, This Would Be It"
06/4/2022,Apple Has Short-Term Volatility But Remains a Strong Long-Term Buy
06/4/2022,"How Advertising's Massive Shift Affects Facebook, Snapchat, and Twitter"
06/4/2022,These Stocks Have the Advantage in the Advertising Revolution
06/3/2022,Apple Was the Worst Stock in the Dow Friday
06/3/2022,"4 Top Stock Trades for Monday: SPY, AAPL, LULU, MU"
06/3/2022,US STOCKS-Wall St ends down with strong jobs data keeping the pressure on for rate hikes
06/3/2022,"After Hours Most Active for Jun 3, 2022 : MNDT, TSM, PM, QQQ, INVA, CERN, INTC, AAPL, ERJ, COTY, INFY, PLTR"
06/3/2022,US STOCKS-Wall St ends down with strong jobs data keeping the pressure on for rate hikes
06/3/2022,"Technology Sector Update for 06/03/2022: AEYE,ASAN,AAPL,OKTA"
06/3/2022,Block (SQ) to Attract Sellers Via Apple's Tap to Pay on iPhone
06/3/2022,"Why Nvidia, Amazon, and Apple Stocks Slumped Friday"
06/3/2022,US STOCKS-Wall St slides as solid jobs data supports rate hike bets
06/3/2022,"Technology Sector Update for 06/03/2022: ASAN,AAPL,OKTA"
06/3/2022,US STOCKS-Wall St slides as solid jobs data supports rate hike bets
06/3/2022,Is Apple a FAANG Stock to Buy on Weakness?
06/3/2022,Consider Alphabet Stock Even in a Recession
06/3/2022,US STOCKS-Wall St slides as solid jobs data supports rate hike bets
06/3/2022,"SPY, DMAY: Big ETF Inflows"
06/3/2022,"Dow Movers: AAPL, IBM"
06/3/2022,Did Tesla's Elon Musk Just Predict the Next Recession?
06/3/2022,"Wall St opens lower after strong jobs data; Apple, Tesla weigh"
06/3/2022,Separating Signal From Noise in the Metaverse
06/3/2022,"Wall Street set to fall after Musk's warning, strong jobs data"
06/3/2022,EXCLUSIVE-EU deal on single mobile charging port likely June 7 in setback for Apple - sources
06/3/2022,"Pre-Market Most Active for Jun 3, 2022 : TQQQ, SQQQ, QQQ, AAPL, TPTX, TSLA, NIO, TWTR, AMC, KSS, PLTR, F"
06/3/2022,Better Buy: Apple vs. Amazon
06/3/2022,What Roku's CEO Said About the Future of Streaming
06/3/2022,EXCLUSIVE-EU deal on single mobile charging port likely June 7 in setback for Apple - sources
06/3/2022,The Market Is Missing This Key Fact About Meta
06/3/2022,EXCLUSIVE-EU set to reach deal on single mobile charging port on June 7 -sources
06/3/2022,7 Long-Term Stocks to Buy That Wall Street Analysts Agree On
06/3/2022,"Warren Buffett Has a ""Hidden"" $6.3 Billion Portfolio: Here's What's in It"
06/2/2022,"Apple: VR/AR Headset, China’s Reopening Could Boost Shares"
06/2/2022,"As Shanghai reopens, California ports prepare for cargo surge"
06/2/2022,Apple to improve working hours for retail staff - Bloomberg News
06/2/2022,Apple to improve working hours for retail staff - Bloomberg News
06/2/2022,Why Block's Apple News Juiced Its Stock Price Today
06/2/2022,"After Hours Most Active for Jun 2, 2022 : INFY, NIO, VALE, BABA, PM, SWN, QQQ, AAPL, CRWD, SQQQ, TQQQ, OKTA"
06/2/2022,"US STOCKS-Wall Street ends sharply higher, led by Tesla and Nvidia"
06/2/2022,"Notable Thursday Option Activity: RH, AAPL, NVDA"
06/2/2022,Block to integrate Square payments with Apple iPhone's 'Tap to Pay' feature
06/2/2022,Meta Platforms' (FB) Sheryl Sandberg Stepping Down as COO
06/2/2022,Meta Platforms' (FB) Sheryl Sandberg Stepping Down as COO
06/2/2022,Is Genius Brands Stock a Buy?
06/2/2022,Microsoft (MSFT) Releases Surface Laptop Go 2 Starting at $599
06/2/2022,Where Will Spotify Be in 5 Years?
06/2/2022,"Got $3,000? 3 Tech Stocks to Buy and Hold for the Long Term"
06/2/2022,3 Metrics to Understand Before Investing in a Company
06/2/2022,2 Semiconductor Stocks That Could Go Parabolic
06/2/2022,Is Schwab Fundamental U.S. Large Company Index ETF (FNDX) a Strong ETF Right Now?
06/2/2022,3 Best Retirement Stocks to Buy for Long-Term Wealth
06/1/2022,Breaking Down the Tech Sector's Earnings Outlook
06/1/2022,Breaking Down the Tech Sector's Earnings Outlook
06/1/2022,Apple (AAPL) Stock Moves -0.09%: What You Should Know
06/1/2022,Big Tech ramps up efforts to quash milestone antitrust bill
06/1/2022,"After Hours Most Active for Jun 1, 2022 : SHV, BABA, C, PLTR, CHWY, NYMT, PM, IBN, AAPL, TLT, QQQ, ERIC"
06/1/2022,"After Hours Most Active for Jun 1, 2022 : SHV, BABA, C, PLTR, CHWY, NYMT, PM, IBN, AAPL, TLT, QQQ, ERIC"
06/1/2022,Disney (DIS) to Premiere Pinocchio Live-Action on Disney Plus
06/1/2022,Wall St slides as strong factory data stokes aggressive rate hike concerns
06/1/2022,Apple Faces Higher Employment Costs: Now What?
06/1/2022,Elon Musk tells Tesla staff: return to office or leave
06/1/2022,Apple (AAPL) Releases Second iOS 15.6 Beta Version Ahead of WWDC
06/1/2022,"Pre-Market Most Active for Jun 1, 2022 : TQQQ, SQQQ, AMC, TXMD, QQQ, BKSY, NIO, GFI, SIGA, AAPL, SNAP, CCL"
06/1/2022,3 Trends That Suggest Crypto Market Will Grow
06/1/2022,Better Metaverse Stock: Broadcom vs. Meta Platforms
06/1/2022,"If You'd Invested $1,000 in Snap In 2017, This Is How Much You Would Have Today"
06/1/2022,Should SPDR S&P 500 ETF (SPY) Be on Your Investing Radar?
06/1/2022,Should Engine No. 1 Transform 500 ETF (VOTE) Be on Your Investing Radar?
06/1/2022,Is SPDR MSCI USA StrategicFactors ETF (QUS) a Strong ETF Right Now?
06/1/2022,Amazon.com says unfairly targeted by U.S. antitrust bill
05/31/2022,Salesforce Stock To Edge Past The Estimates In Q1?
05/31/2022,IPhone Maker Foxconn Says China Covid Curbs Did Not Significantly Impact Supply Chain
05/31/2022,U.S. investigates Chinese companies over export sanction issues
05/31/2022,"After Hours Most Active for May 31, 2022 : CSCO, MRO, T, BAC, KO, WBD, KMI, PFE, AGNC, AAPL, APA, CSX"
05/31/2022,The Tide Has Turned Against Vinco Ventures Stock Investors
05/31/2022,GameStop Stock Is too Risky for Most Investors
05/31/2022,3 Tech Stocks to Buy After Nvidia’s Earnings Report
05/31/2022,Dow Analyst Moves: AAPL
05/31/2022,Snap Stock: Bear vs. Bull
05/31/2022,Should Fidelity Nasdaq Composite Index ETF (ONEQ) Be on Your Investing Radar?
05/31/2022,"Stock Market News for May 31, 2022"
05/31/2022,Why It Makes Sense That Apple Is Warren Buffett's Largest Holding
05/31/2022,"Pre-Market Most Active for May 31, 2022 : AMC, TQQQ, SQQQ, SIGA, NIO, QQQ, AUY, DIDI, TXMD, AAPL, BEKE, BABA"
05/31/2022,Buy AAPL Stock Now Before Apple’s 2022 Product Release Ramp-Up
05/31/2022,3 Dividend Stocks That Are Good Enough for Warren Buffett
05/31/2022,3 Stocks That Could Be Worth More Than Apple by 2040
05/30/2022,Foxconn predicts more stable supply chain in the second half of 2022
05/30/2022,The 7 Best Tech Stocks to Buy for June 2022
05/30/2022,Warren Buffett Is Tiptoeing His Way Into This Stock
05/30/2022,"Now Down Almost 50%, Will Meta Platforms Rebound Anytime Soon?"
05/30/2022,Should Vanguard S&P 500 ETF (VOO) Be on Your Investing Radar?
05/30/2022,Should Vanguard LargeCap ETF (VV) Be on Your Investing Radar?
05/30/2022,Should Vanguard S&P 500 Growth ETF (VOOG) Be on Your Investing Radar?
05/30/2022,Should iShares MSCI USA Multifactor ETF (LRGF) Be on Your Investing Radar?
05/30/2022,10 Reasons Warren Buffett Is Such a Successful Investor
05/29/2022,The 2 Smartest Tech Stocks to Buy in 2022 and Beyond
05/29/2022,Here's Why Alphabet Is Even Cheaper Than It Looks
05/29/2022,3 Cash Cow Tech Stocks to Buy Now
05/29/2022,7 ETFs With Dividends to Fight Any Market Downturns
05/29/2022,Novice Investors Should Copy These 2 Warren Buffett Strategies -- and Avoid This Other One at All Costs
05/28/2022,Is Apple an Excellent Dividend Stock to Buy?
05/28/2022,"If I Could Only Buy 1 Stock, This Would Be It"
05/28/2022,7 Warren Buffett Stocks to Buy in June and Hold for Years
05/27/2022,"Wall Street rallies, snaps longest weekly losing streak in decades"
05/27/2022,US STOCKS-Wall Street rallies to end longest weekly losing streak in decades
05/27/2022,"US STOCKS-Wall Street surges, on course to snap longest weekly losing streak in decades"
05/27/2022,Wall Street Looks for Respite as Investors Place Inflation Wagers
05/27/2022,Why Apple Stock Is Rising Today
05/27/2022,Do You Know Your Exposure to Mega Cap Stocks?
05/27/2022,"Russia opens cases against Google, other foreign tech over data storage"
05/27/2022,"Dow Movers: UNH, AAPL"
05/27/2022,Is Meta Platforms Stock a Buy Now?
05/27/2022,"Down 55%, Spotify's CEO Recently Bought Shares. Should Investors Follow Suit?"
05/27/2022,My 3 Best Stock-Split Stocks to Buy -- Even in a Market Sell-Off
05/27/2022,Should WisdomTree U.S. Total Dividend ETF (DTD) Be on Your Investing Radar?
05/27/2022,Snap’s Revenue Warning Had Really Poor Timing
05/27/2022,"Zacks Investment Ideas feature highlights: Snapchat, Alphabet, Meta Platforms, Twitter and Apple"
05/27/2022,The Under-the-Radar Stock Warren Buffett Has Invested $61 Billion Into in Less Than 4 Years
05/27/2022,"Taiwan revises down 2022 GDP growth forecast, hit by COVID and inflation"
05/27/2022,Is Apple Stock A Buy At $140?
05/26/2022,"U.S. bill would bar Google, Apple from hosting apps that accept China's digital yuan"
05/26/2022,TREASURIES-U.S. Treasury yields steady on slower growth outlook
05/26/2022,"US STOCKS-Wall Street jumps on retailer outlook hikes, ebbing Fed fears"
05/26/2022,"After Hours Most Active for May 26, 2022 : BABA, QQQ, AAPL, GPS, CCL, WPCB, CMCSA, APO, BAC, ERIC, TQQQ, PMVP"
05/26/2022,TJX Is a Bright Spot in Retail
05/26/2022,Why Alphabet Investors Shouldn't Lose Sleep Over Snap's Recent Guidance
05/26/2022,TREASURIES-U.S. yields edge up on slower growth outlook
05/26/2022,"U.S. bill would bar Google, Apple from hosting apps that accept China's digital yuan"
05/26/2022,"Noteworthy Thursday Option Activity: AAPL, BA, CZR"
05/26/2022,3 Value Stocks to Buy With At Least 50% Upside
05/26/2022,TREASURIES-U.S. yields little changed as inflation fears dissipate
05/26/2022,The 7 Best Reddit Stocks to Buy for June 2022
05/26/2022,"Dow Movers: AAPL, NKE"
05/26/2022,2 Low-Stress Dividend Stocks to Buy Now
05/26/2022,Ignore the Doubters -- This Growth Stock Still Has a Bright Future
05/26/2022,Global firms warn of sluggish China demand due to lengthy COVID curbs
05/26/2022,"Pre-Market Most Active for May 26, 2022 : BKSY, TQQQ, SQQQ, M, JOBY, NVDA, BABA, IQ, AAPL, NTNX, TJX, RTX"
05/26/2022,Got $500? Consider This Beginner Basket of 4 Top Stocks
05/26/2022,Why Apple Stock Could Keep Falling
05/26/2022,Is Deere the Apple of Agriculture?
05/26/2022,Alphabet's AR Breakthrough Could Completely Change Travel
05/26/2022,What These 3 Key Metrics Tell You About a Stock
05/26/2022,"US STOCKS-S&P, Dow futures edge higher ahead of GDP data; Nvidia slides"
05/26/2022,Should SPDR Portfolio S&P 500 ETF (SPLG) Be on Your Investing Radar?
05/26/2022,Is FlexShares Morningstar U.S. Market Factor Tilt ETF (TILT) a Strong ETF Right Now?
05/26/2022,3 Ways to Sleep Easy in a Market Downturn
05/26/2022,Apple to keep iPhone production flat in 2022 - Bloomberg News
05/26/2022,Global firms warn of sluggish China demand due to lengthy COVID curbs
05/25/2022,Apple hikes pay budget for U.S. workers - WSJ
05/25/2022,Apple boosts pay budget for U.S. workers - WSJ
05/25/2022,7 Warren Buffett Stocks to Be Just Like Berkshire 
05/25/2022,Apple VP Discourages Retail Employees From Joining A Union: Reports
05/25/2022,"After Hours Most Active for May 25, 2022 : INFY, AAPL, GOLD, SNOW, NVDA, QQQ, PICC, DT, BAC, TQQQ, SQQQ, TLT"
05/25/2022,An Overview of the Top 5 Wearables Companies
05/25/2022,This High-Powered Growth Stock Just Beat Earnings and Is Trading Near Its 52-Week Low
05/25/2022,"Vedanta to finalize $20 billion Indian chip, display unit site by mid-June -Chairman"
05/25/2022,Meta Platforms: Is FB Stock Dirt Cheap or Cheap Dirt?
05/25/2022,Wall Street Says This Software Name Is Set to Double
05/25/2022,7 Retirement Stocks to Buy to Turbocharge Your Savings
05/25/2022,US STOCKS-Wall St set for weak open ahead of Fed minutes
05/25/2022,Lost Among the Stock Splits: 1 Unstoppable Stock You'll Regret Not Buying on the Dip
05/25/2022,"EA Plans to Sell or Merge: Will AAPL, AMZN, DIS Show Interest?"
05/25/2022,"Pre-Market Most Active for May 25, 2022 : TQQQ, SNAP, SQQQ, XOM, DKS, BSX, AAPL, QQQ, ELEV, NVDA, CCL, NIO"
05/25/2022,2 Stocks to Buy With the Nasdaq in Bear Market Territory
05/25/2022,Russia's VK launches RuStore for apps after exit of Western alternatives
05/25/2022,Apple Can’t Lift the Market by Itself
05/25/2022,3 Things About Apple That Smart Investors Know
05/25/2022,Target Shares Are Down. 3 Reasons I'm Not Panicking
05/25/2022,Is iShares ESG Aware MSCI USA ETF (ESGU) a Strong ETF Right Now?
05/25/2022,How Do You Stay Confident in a Market Crash?
05/25/2022,Apple's iPhone development schedule delayed by China lockdowns - Nikkei
05/25/2022,Apple's iPhone development schedule delayed by China lockdowns - Nikkei
05/24/2022,7 Safe Stocks to Buy and Hold Onto Forever
05/24/2022,Why Apple Escaped Tuesday's Tech Stock Meltdown
05/24/2022,Why High Dividend ETFs are Beating the Market
05/24/2022,The OLED Market Is Set to Grow. How Can Investors Take Advantage of Its Bright Outlook?
05/24/2022,"IVV, SOXS: Big ETF Inflows"
05/24/2022,SNAP Expects Reduced Profit Amid Economic Disruptions
05/24/2022,Apple Announces New Pride Edition Bands
05/24/2022,Forget the 4% Rule. This Could Let You Retire on $500K (on Dividends Alone)
05/24/2022,"Stock Market News for May 24, 2022"
05/24/2022,Apple Inc. (AAPL) is Attracting Investor Attention: Here is What You Should Know
05/24/2022,Implied Volatility Surging for Apple (AAPL) Stock Options
05/24/2022,Here's Shiba Inu's Only Path to $1
05/24/2022,"Pre-Market Most Active for May 24, 2022 : SNAP, TQQQ, SQQQ, PBR, BBY, QQQ, SIGA, FB, AAPL, NVS, MOS, BAX"
05/24/2022,"With Both Down More Than 40%, Should Investors Buy Meta Platforms or Netflix?"
05/24/2022,Dell Technologies (DELL) to Post Q1 Earnings: What's in Store?
05/24/2022,1 Green Growth Stock to Buy After Tesla's ESG-Index Exile
05/24/2022,"In Case Things Weren't Bad Enough, Meta Platforms Could Face Additional Headwinds in 2022"
05/24/2022,Should iShares Russell 1000 ETF (IWB) Be on Your Investing Radar?
05/24/2022,Is WisdomTree U.S. LargeCap Dividend ETF (DLN) a Strong ETF Right Now?
05/24/2022,This Warren Buffett Stock Just Proved Why It's a Great Buy
05/24/2022,Here Are Warren Buffett's 10 Best Dividend Stocks
05/24/2022,Russia's no. 1 mobile operator MTS starts selling used and discounted smartphones
05/23/2022,Dow Up 600+ Points to Start New Trading Week
05/23/2022,Apple Stock Is a Buy Despite Its Flaws
05/23/2022,"Wall Street rallies on back of big tech, banks"
05/23/2022,"After Hours Most Active for May 23, 2022 : NIO, T, AAPL, INFY, ZM, SABR, MCHI, MSFT, QQQ, WFC, PINS, CCL"
05/23/2022,"US STOCKS-Wall Street rallies to higher close boosted by banks, big tech"
05/23/2022,Workers at 'Call of Duty' creator Activision Blizzard vote to join union
05/23/2022,"US STOCKS-Wall Street rebounds with assist from banks, big tech"
05/23/2022,Why Apple Stock Jumped on Monday
05/23/2022,"US STOCKS-Wall Street bounces back on boost from banks, Apple after volatile week"
05/23/2022,"S&P 500, Dow rise as banks, Apple offer support"
05/23/2022,3 Top AI Stocks Ready for Bull Runs
05/23/2022,Disney to Exclusively Stream New Series Baymax on Disney Plus
05/23/2022,SNAP Introduces New AR Lenses to Electric Daisy Carnival
05/23/2022,"S&P 500, Dow rise as banks, Apple offer support"
05/23/2022,The Tech Stocks to Buy Now
05/23/2022,US STOCKS-Wall St set to rebound after volatile week; takeover talks boost VMware
05/23/2022,"Pre-Market Most Active for May 23, 2022 : SIGA, TQQQ, CMRX, SQQQ, NVDA, AAPL, NIO, NEE, MRO, SQ, BMY, NVS"
05/23/2022,Buy This FAANG Stock During the Tech Sell-Off
05/23/2022,"US STOCKS-Futures rebound after volatile week, takeover talks boost VMware"
05/23/2022,These 2 Tech Giants Just Declared Dividend Raises. Are They Buys?
05/23/2022,Should Invesco FTSE RAFI US 1000 ETF (PRF) Be on Your Investing Radar?
05/23/2022,4 Dow Stocks Billionaire Money Managers Bought Hand Over Fist in the First Quarter
05/22/2022,Looking for Tech Stocks? These 3 Are Great Buys.
05/22/2022,"Across the World, Apple faces Macro Pressures"
05/22/2022,"If You Invested $1,000 in Apple in 2010, This Is How Much You Would Have Today"
05/22/2022,3 Divergent Stocks to Buy Right Now
05/22/2022,How Airbnb Is Giving Power to Its People
05/21/2022,Better Buy: Apple vs. Alphabet
05/21/2022,Apple looks to boost production outside China- WSJ
05/21/2022,Why It Might Be a Lucrative Time to Buy Spotify Stock
05/21/2022,Is Unity Software's Growth Slowdown a Permanent Problem?
05/21/2022,The Nasdaq Is Down 27%: It's Time to Buy These 3 Stocks
05/21/2022,Want to Get Richer? 5 Top Stocks to Buy Now and Hold Forever
05/20/2022,3 Stocks to Buy the Dip Now
05/20/2022,McDonald's Is Exiting Russia. Will Other Restaurants Follow?
05/20/2022,"US STOCKS-Wall Street ends mixed, Tesla falls"
